{
  "$schema": "https://json-schema.org/draft/2020-12/schema",
  "$id": "https://rio-protocol.org/spec/receipt_schema.json",
  "title": "RIO Receipt",
  "description": "Canonical receipt schema for the RIO protocol. This is the single authoritative definition. All receipt definitions in this repository MUST match this schema. Source of truth: test vectors in tests/vectors/.",
  "type": "object",
  "required": [
    "receipt_version",
    "receipt_id",
    "timestamp",
    "runtime_id",
    "runtime_version",
    "environment",
    "request_summary",
    "request_hash",
    "request_canonical_payload",
    "policy_bundle_id",
    "policy_bundle_hash",
    "decision",
    "decision_reason_codes",
    "invariant_results",
    "threshold_results",
    "model_output_hash",
    "model_output_preview",
    "prev_ledger_hash",
    "public_key_fingerprint",
    "receipt_hash",
    "signature_algorithm",
    "signature"
  ],
  "properties": {
    "receipt_version": {
      "type": "string",
      "description": "Protocol version of this receipt format",
      "examples": ["1.0"]
    },
    "receipt_id": {
      "type": "string",
      "format": "uuid",
      "description": "Unique identifier for this receipt"
    },
    "timestamp": {
      "type": "string",
      "format": "date-time",
      "description": "ISO 8601 timestamp with microsecond precision and UTC timezone (Z suffix)",
      "examples": ["2025-01-15T12:00:00.000000Z"]
    },
    "runtime_id": {
      "type": "string",
      "description": "Identifier of the runtime that produced this receipt"
    },
    "runtime_version": {
      "type": "string",
      "description": "Version of the runtime"
    },
    "environment": {
      "type": "string",
      "description": "Execution environment (e.g., test, staging, production)"
    },
    "request_summary": {
      "type": "string",
      "description": "Human-readable summary of the original request"
    },
    "request_hash": {
      "type": "string",
      "pattern": "^[a-f0-9]{64}$",
      "description": "SHA-256 hash of the canonical request payload"
    },
    "request_canonical_payload": {
      "type": "object",
      "description": "The canonical representation of the original request"
    },
    "policy_bundle_id": {
      "type": "string",
      "description": "Identifier of the policy bundle used for evaluation"
    },
    "policy_bundle_hash": {
      "type": "string",
      "pattern": "^[a-f0-9]{64}$",
      "description": "SHA-256 hash of the policy bundle"
    },
    "decision": {
      "type": "string",
      "enum": ["allow", "block", "escalate", "modify"],
      "description": "Final decision: allow (execution proceeds), block (execution denied), escalate (requires human review), modify (execution narrowed to stated parameters)"
    },
    "decision_reason_codes": {
      "type": "array",
      "items": { "type": "string" },
      "description": "Machine-readable codes explaining the decision"
    },
    "invariant_results": {
      "type": "object",
      "description": "Results of invariant checks (boolean pass/fail for each invariant)"
    },
    "threshold_results": {
      "type": "object",
      "description": "Results of threshold evaluations (scores and thresholds)"
    },
    "model_output_hash": {
      "type": "string",
      "pattern": "^[a-f0-9]{64}$",
      "description": "SHA-256 hash of the model output"
    },
    "model_output_preview": {
      "type": "string",
      "description": "Truncated preview of the model output"
    },
    "prev_ledger_hash": {
      "type": "string",
      "pattern": "^[a-f0-9]{64}$",
      "description": "SHA-256 hash of the previous ledger entry. For the first receipt, this is SHA-256('GENESIS') = 901131d838b17aac0f7885b81e03cbdc9f5157a00343d30ab22083685ed1416a"
    },
    "public_key_fingerprint": {
      "type": "string",
      "pattern": "^[a-f0-9]{64}$",
      "description": "SHA-256 fingerprint of the Ed25519 public key used to sign this receipt"
    },
    "receipt_hash": {
      "type": "string",
      "pattern": "^[a-f0-9]{64}$",
      "description": "SHA-256 hash of the canonical JSON of all signed fields (all fields except receipt_hash, signature, and signature_algorithm)"
    },
    "signature_algorithm": {
      "type": "string",
      "const": "Ed25519",
      "description": "Signing algorithm. Always Ed25519 for receipts."
    },
    "signature": {
      "type": "string",
      "description": "Base64-encoded Ed25519 signature over the canonical JSON of the signed fields"
    }
  },
  "additionalProperties": false
}
